{"schema_version":"1.0.0","profile_id":"profile.local-learner","learner_id":"11111111-1111-4111-8111-111111111111","revision":1,"goals":[],"experience":[],"interests":[],"created_at":"2026-10-17T18:00:00Z","updated_at":"2026-10-17T18:00:00Z","profile_digest":"d30eecfd7e88c2f219056d824362e61dc6447dc572816f06a91247d3b5e24bce"}
