{"schema_version":"1.0.0","profile_id":"profile.local-learner","learner_id":"11111111-1111-4111-8111-111111111111","revision":4,"goals":[{"goal_id":"goal.research-literacy","title":"Understand how financial evidence is tested","detail":"Practice checking assumptions, sources, and limitations.","archived":false,"created_at":"2026-10-17T18:01:00Z","updated_at":"2026-10-17T18:01:00Z"}],"experience":[{"experience_id":"experience.python","subject":"Python for data analysis","level":"some_experience","detail":"I have used notebooks for class exercises.","created_at":"2026-10-17T18:02:00Z","updated_at":"2026-10-17T18:02:00Z"}],"interests":[{"interest_id":"interest.market-structure","label":"How markets match buyers and sellers","created_at":"2026-10-17T18:03:00Z","updated_at":"2026-10-17T18:03:00Z"}],"created_at":"2026-10-17T18:00:00Z","updated_at":"2026-10-17T18:03:00Z","profile_digest":"3bafc94452c22184dfab79023d6659c571aca1cab02d00f55f0624daadc7088e"}
